{
  "$schema": "https://json-schema.org/draft/2020-12/schema",
  "$id": "wasitme.glance/1",
  "title": "wasitme glance (menu bar, popover, desktop panel, Claude Code mod and band, status-line source, CLI)",
  "description": "FROZEN at the contract freeze (docs/CONTRACT.md, DECISIONS D22). Written atomically (temp file + rename) by the engine to ~/.wasitme/glance.json (WASITME_HOME overrides ~/.wasitme). The engine writes compact JSON of at most 16 KB. After the freeze only additive changes are allowed, made to this schema and contract/fixtures/ in the same commit. Consumers never validate against this schema: they decode tolerantly, ignore unknown fields, render an unknown state as 'unclear', an unknown reason as null and an unknown side as 'unknown', refuse a document whose privacy.containsText is not the boolean false, show 'Update needed' for any other schema id, and compute the display state 'stale' themselves (docs/CONTRACT.md#display-rules). Every string is engine-owned text: consumers render it as plain text, strip control/format characters and bound it before drawing.",
  "type": "object",
  "additionalProperties": false,
  "required": ["schema", "engine", "generatedAt", "staleAfterSec", "scanOk", "scanError", "demo", "lead", "agents", "privacy"],
  "properties": {
    "schema": { "const": "wasitme.glance/1" },
    "engine": { "type": "string", "minLength": 1, "maxLength": 32, "description": "engine version" },
    "generatedAt": { "type": "string", "format": "date-time", "description": "RFC 3339 with an explicit offset" },
    "staleAfterSec": { "type": "integer", "minimum": 60, "maximum": 604800, "description": "display 'stale' once now - generatedAt exceeds this (consumer default 7200 when absent)" },
    "scanOk": { "type": "boolean" },
    "scanError": { "$ref": "#/$defs/scanError" },
    "demo": { "type": "boolean", "description": "true only for `wasitme demo` output; surfaces show a DEMO ribbon" },
    "lead": { "enum": ["timeline", "verdict"], "description": "layout: lead with the change timeline or with the verdict (D28)" },
    "agents": {
      "type": "array",
      "maxItems": 8,
      "description": "Engine-ordered. A single-glyph surface (menu bar, status line) speaks for agents[0]. Agents are never pooled.",
      "items": { "$ref": "#/$defs/agent" }
    },
    "privacy": { "$ref": "#/$defs/privacy" }
  },
  "$defs": {
    "scanError": {
      "description": "Why the last scan failed, as a kind (never text). null when scanOk is true. Consumers treat an unknown kind as 'internal'.",
      "enum": [null, "permission_denied", "write_failed", "timeout", "internal"]
    },
    "privacy": {
      "type": "object",
      "additionalProperties": false,
      "required": ["containsText"],
      "properties": { "containsText": { "const": false } }
    },
    "day": { "type": "string", "format": "date", "description": "local calendar day YYYY-MM-DD" },
    "state": {
      "description": "D22 verdict state. Display order: insufficient, none, unclear, you, agent. 'stale' is a display state computed by consumers, never written here.",
      "enum": ["you", "agent", "none", "insufficient", "unclear"]
    },
    "reason": {
      "description": "The decision-table row's reason (METHOD.md §11), or null when the state needs none (you; agent with an agent-strong candidate; none). insufficient: calibration_pending | needs_data | single_indicator. unclear: mixed | workload | unknown_provenance | both_sides | nothing_recorded_on_your_side | blind_spot. agent: by_elimination | null.",
      "enum": [null, "calibration_pending", "needs_data", "single_indicator", "mixed", "workload", "unknown_provenance", "both_sides", "nothing_recorded_on_your_side", "blind_spot", "by_elimination"]
    },
    "side": { "description": "Who initiated a change (METHOD.md §9). 'unknown' is never 'agent'; 'meta' is wasitme's own writes or a parser change.", "enum": ["you", "agent", "unknown", "meta"] },
    "strength": { "enum": ["strong", "weak", "routine"] },
    "family": { "description": "metric family; null for context metrics without one (e.g. churn)", "enum": [null, "errors", "research", "friction"] },
    "role": { "enum": ["vote", "support", "context"] },
    "metricStatus": { "enum": ["worse", "better", "none", "ineligible"] },
    "count": { "type": "integer", "minimum": 0, "maximum": 1000000000 },
    "kn": {
      "type": "object",
      "description": "integer totals for one window: k events over n opportunities (readsPerEdit: k reads over n edits)",
      "additionalProperties": false,
      "required": ["k", "n"],
      "properties": { "k": { "$ref": "#/$defs/count" }, "n": { "$ref": "#/$defs/count" } }
    },
    "ratio": { "type": ["number", "null"], "minimum": 0 },
    "range": {
      "description": "the interval around the ratio, printed as 'range' (never '99%', D31); null when not computed",
      "oneOf": [
        { "type": "null" },
        { "type": "array", "minItems": 2, "maxItems": 2, "items": { "type": "number", "minimum": 0 } }
      ]
    },
    "metricId": { "type": "string", "minLength": 1, "maxLength": 32 },
    "topMetric": {
      "type": "object",
      "additionalProperties": false,
      "required": ["id", "label", "unit", "family", "role", "recent", "baseline", "ratio", "range", "mde", "status"],
      "properties": {
        "id": { "$ref": "#/$defs/metricId" },
        "label": { "type": "string", "maxLength": 40 },
        "unit": { "type": "string", "maxLength": 24 },
        "family": { "$ref": "#/$defs/family" },
        "role": { "$ref": "#/$defs/role" },
        "recent": { "$ref": "#/$defs/kn" },
        "baseline": { "$ref": "#/$defs/kn" },
        "ratio": { "$ref": "#/$defs/ratio" },
        "range": { "$ref": "#/$defs/range" },
        "mde": { "type": ["number", "null"], "minimum": 1, "description": "minimum detectable ratio: changes smaller than this would not show" },
        "status": { "$ref": "#/$defs/metricStatus" }
      }
    },
    "stripDay": {
      "type": "object",
      "additionalProperties": false,
      "required": ["d", "k", "n"],
      "properties": { "d": { "$ref": "#/$defs/day" }, "k": { "$ref": "#/$defs/count" }, "n": { "$ref": "#/$defs/count" } }
    },
    "strip": {
      "description": "chart data for one metric: daily integer k/n (no per-day bands) plus one window-level ratio, range and MDE. null when there is nothing to chart.",
      "oneOf": [
        { "type": "null" },
        {
          "type": "object",
          "additionalProperties": false,
          "required": ["metric", "days", "window"],
          "properties": {
            "metric": { "$ref": "#/$defs/metricId" },
            "days": { "type": "array", "maxItems": 42, "items": { "$ref": "#/$defs/stripDay" } },
            "window": {
              "type": "object",
              "additionalProperties": false,
              "required": ["ratio", "lo", "hi", "mde"],
              "properties": {
                "ratio": { "$ref": "#/$defs/ratio" },
                "lo": { "type": ["number", "null"], "minimum": 0 },
                "hi": { "type": ["number", "null"], "minimum": 0 },
                "mde": { "type": ["number", "null"], "minimum": 1 }
              }
            }
          }
        }
      ]
    },
    "event": {
      "type": "object",
      "additionalProperties": false,
      "required": ["day", "kind", "side", "strength", "label", "new"],
      "properties": {
        "day": { "$ref": "#/$defs/day" },
        "kind": { "type": "string", "minLength": 1, "maxLength": 24, "description": "engine ChangeKind; consumers show a generic mark for a kind they don't know" },
        "side": { "$ref": "#/$defs/side" },
        "strength": { "$ref": "#/$defs/strength" },
        "label": { "type": "string", "maxLength": 60 },
        "new": { "type": "boolean", "description": "appeared since the previous scan (the menu bar's 'new' mark)" }
      }
    },
    "gateCounts": {
      "type": "object",
      "additionalProperties": false,
      "required": ["events", "sessions", "sessionDays"],
      "properties": { "events": { "$ref": "#/$defs/count" }, "sessions": { "$ref": "#/$defs/count" }, "sessionDays": { "$ref": "#/$defs/count" } }
    },
    "unlock": {
      "type": "object",
      "description": "one gate shortfall, shown in sessions and session-days (METHOD.md §13); never for interrupts",
      "additionalProperties": false,
      "required": ["metric", "family", "have", "need"],
      "properties": {
        "metric": { "$ref": "#/$defs/metricId" },
        "family": { "$ref": "#/$defs/family" },
        "have": { "$ref": "#/$defs/gateCounts" },
        "need": { "$ref": "#/$defs/gateCounts" }
      }
    },
    "progress": {
      "description": "tier-based progress (METHOD.md §4, §13); null when there is nothing to unlock",
      "oneOf": [
        { "type": "null" },
        {
          "type": "object",
          "additionalProperties": false,
          "required": ["tier", "etaDate", "notAtCurrentPace", "unlock"],
          "properties": {
            "tier": { "type": "integer", "minimum": 1, "maximum": 3, "description": "the tier the ETA refers to" },
            "etaDate": { "oneOf": [{ "type": "null" }, { "$ref": "#/$defs/day" }] },
            "notAtCurrentPace": { "type": "boolean", "description": "true: no tier gets there at the current pace; etaDate is null and no day count is shown" },
            "unlock": { "type": "array", "maxItems": 6, "items": { "$ref": "#/$defs/unlock" } }
          }
        }
      ]
    },
    "n": {
      "type": "object",
      "additionalProperties": false,
      "required": ["exchanges", "sessions", "sessionDays", "days"],
      "properties": {
        "exchanges": { "$ref": "#/$defs/count" },
        "sessions": { "$ref": "#/$defs/count" },
        "sessionDays": { "$ref": "#/$defs/count" },
        "days": { "$ref": "#/$defs/count" }
      }
    },
    "agentId": { "type": "string", "minLength": 1, "maxLength": 32, "description": "open string: claude-code, codex, or a future agent" },
    "agent": {
      "type": "object",
      "additionalProperties": false,
      "required": ["agent", "state", "reason", "pending", "calibrated", "label", "headline", "because", "tryThis", "confidence", "band", "statusLine", "n", "progress", "topMetrics", "strip", "events"],
      "properties": {
        "agent": { "$ref": "#/$defs/agentId" },
        "state": { "$ref": "#/$defs/state" },
        "reason": { "$ref": "#/$defs/reason" },
        "pending": { "type": "boolean", "description": "a state change is waiting for a second agreeing evaluation; the state shown is the held one" },
        "calibrated": { "type": "boolean", "description": "this agent passed its own null calibration (D23); false means state insufficient, reason calibration_pending" },
        "label": { "type": "string", "maxLength": 24, "description": "state label, e.g. 'Too early to tell'" },
        "headline": { "type": "string", "maxLength": 80 },
        "because": { "type": "string", "maxLength": 200 },
        "tryThis": { "type": "string", "maxLength": 160 },
        "confidence": { "type": "string", "maxLength": 160 },
        "band": { "type": "string", "maxLength": 100, "description": "the Claude Code band line; empty unless band-eligible" },
        "statusLine": { "type": "string", "maxLength": 80, "description": "plain status-line segment (no ANSI)" },
        "n": { "$ref": "#/$defs/n" },
        "progress": { "$ref": "#/$defs/progress" },
        "topMetrics": { "type": "array", "maxItems": 3, "items": { "$ref": "#/$defs/topMetric" } },
        "strip": { "$ref": "#/$defs/strip" },
        "events": { "type": "array", "maxItems": 5, "items": { "$ref": "#/$defs/event" } }
      }
    }
  }
}
