{
  "schema": "wasitme.glance/1",
  "engine": "0.1.0",
  "generatedAt": "2026-10-04T18:00:00Z",
  "staleAfterSec": 7200,
  "scanOk": true,
  "scanError": null,
  "demo": false,
  "lead": "verdict",
  "agents": [
    {
      "agent": "claude-code",
      "state": "agent",
      "reason": null,
      "pending": false,
      "calibrated": true,
      "label": "Agent side",
      "headline": "Nothing recorded changed on your side; Claude Code served another model.",
      "because": "Around the time Claude Code began serving a different model than you picked (Sep 30), your tool errors (×2.6) and edits without reading first (×1.9) rose.",
      "tryThis": "If you file an issue, share the report — it says what it can and can't show.",
      "confidence": "Based on 395 exchanges over 30 session-days (9 sessions) on this Mac. Sessions on other machines aren't visible. Some days weren't fully observed.",
      "band": "Agent side: Claude Code served a different model than you picked (Sep 30).",
      "statusLine": "wasitme: agent side +1",
      "n": {
        "exchanges": 395,
        "sessions": 9,
        "sessionDays": 30,
        "days": 14
      },
      "progress": null,
      "topMetrics": [
        {
          "id": "toolErrors",
          "label": "Tool errors",
          "unit": "per 100 tool calls",
          "family": "errors",
          "role": "vote",
          "recent": {
            "k": 286,
            "n": 3120
          },
          "baseline": {
            "k": 201,
            "n": 5610
          },
          "ratio": 2.56,
          "range": [
            1.48,
            4.43
          ],
          "mde": 2,
          "status": "worse"
        },
        {
          "id": "blindEdits",
          "label": "Edits without reading first",
          "unit": "per 100 edits",
          "family": "research",
          "role": "vote",
          "recent": {
            "k": 74,
            "n": 410
          },
          "baseline": {
            "k": 79,
            "n": 820
          },
          "ratio": 1.87,
          "range": [
            1.21,
            2.9
          ],
          "mde": 1.7,
          "status": "worse"
        }
      ],
      "strip": {
        "metric": "toolErrors",
        "days": [
          {
            "d": "2026-09-06",
            "k": 8,
            "n": 231
          },
          {
            "d": "2026-09-07",
            "k": 5,
            "n": 160
          },
          {
            "d": "2026-09-08",
            "k": 11,
            "n": 290
          },
          {
            "d": "2026-09-09",
            "k": 7,
            "n": 214
          },
          {
            "d": "2026-09-10",
            "k": 6,
            "n": 188
          },
          {
            "d": "2026-09-11",
            "k": 9,
            "n": 247
          },
          {
            "d": "2026-09-12",
            "k": 4,
            "n": 121
          },
          {
            "d": "2026-09-13",
            "k": 0,
            "n": 38
          },
          {
            "d": "2026-09-14",
            "k": 7,
            "n": 205
          },
          {
            "d": "2026-09-15",
            "k": 10,
            "n": 262
          },
          {
            "d": "2026-09-16",
            "k": 8,
            "n": 230
          },
          {
            "d": "2026-09-17",
            "k": 6,
            "n": 176
          },
          {
            "d": "2026-09-18",
            "k": 9,
            "n": 219
          },
          {
            "d": "2026-09-19",
            "k": 5,
            "n": 150
          },
          {
            "d": "2026-09-20",
            "k": 7,
            "n": 201
          },
          {
            "d": "2026-09-21",
            "k": 19,
            "n": 224
          },
          {
            "d": "2026-09-22",
            "k": 24,
            "n": 251
          },
          {
            "d": "2026-09-23",
            "k": 22,
            "n": 230
          },
          {
            "d": "2026-09-24",
            "k": 18,
            "n": 196
          },
          {
            "d": "2026-09-25",
            "k": 15,
            "n": 171
          },
          {
            "d": "2026-09-26",
            "k": 26,
            "n": 262
          },
          {
            "d": "2026-09-27",
            "k": 21,
            "n": 228
          },
          {
            "d": "2026-09-28",
            "k": 6,
            "n": 64
          },
          {
            "d": "2026-09-29",
            "k": 23,
            "n": 244
          },
          {
            "d": "2026-09-30",
            "k": 25,
            "n": 259
          },
          {
            "d": "2026-10-01",
            "k": 27,
            "n": 276
          },
          {
            "d": "2026-10-02",
            "k": 30,
            "n": 296
          },
          {
            "d": "2026-10-03",
            "k": 33,
            "n": 248
          }
        ],
        "window": {
          "ratio": 2.56,
          "lo": 1.48,
          "hi": 4.43,
          "mde": 2
        }
      },
      "events": [
        {
          "day": "2026-10-02",
          "kind": "config",
          "side": "you",
          "strength": "weak",
          "label": "Settings changed",
          "new": true
        },
        {
          "day": "2026-10-01",
          "kind": "version",
          "side": "agent",
          "strength": "routine",
          "label": "Claude Code 2.1.277 → 2.1.281",
          "new": false
        },
        {
          "day": "2026-09-30",
          "kind": "served-model",
          "side": "agent",
          "strength": "strong",
          "label": "Served model differs from the one you picked",
          "new": false
        },
        {
          "day": "2026-09-24",
          "kind": "version",
          "side": "agent",
          "strength": "routine",
          "label": "Claude Code 2.1.274 → 2.1.277",
          "new": false
        },
        {
          "day": "2026-09-18",
          "kind": "version",
          "side": "agent",
          "strength": "routine",
          "label": "Claude Code 2.1.270 → 2.1.274",
          "new": false
        }
      ]
    }
  ],
  "privacy": {
    "containsText": false
  }
}
